thesis/TFG_Latex2526/figures and tables/3_Results/Tables/1 Pipeline Execution ASOCA vs. MACS-18/Table 2. Metrics Ostium Centerline Comparison.csv

Cohort,Subgroup,Ostium accuracy (%),Centerline precision (%)
ASOCA,All,85.0,83.19
ASOCA,Normal,85.0,83.18
ASOCA,Diseased,85.0,83.21
MACS-18,All,73.75,95.62
MACS-18,Normal,75.0,96.87
MACS-18,Diseased,72.5,94.04

notebooks/results visualizations/TFG Results v2.md

# **1 Pipeline Validation on MACS-18**

CESRNormal \= Number of correctly extracted centerlinesNumber of attempted centerline extractions \= 96.87%  
CESRDiseased \= Number of correctly extracted centerlinesNumber of attempted centerline extractions \= 94.04%  
CESRTotal \= Number of correctly extracted centerlinesNumber of attempted centerline extractions \=  95.62%

**Discussion:** Contrary to the challenges observed in ostium identification, the Centerline Extraction Success Rate (CESR) demonstrated a noticeable improvement when processing the MACS-18 dataset. This increase in algorithmic robustness can be directly attributed to the superior spatial resolution and geometric fidelity of the MACS-18 CCTA scans.  
Centerline extraction algorithms, such as those implemented in VMTK, rely heavily on the internal Voronoi diagram of the 3D surface mesh to compute optimal paths. In lower-resolution datasets like ASOCA, severe stenoses or highly distal vessel segments often suffer from partial volume effects, leading to artificial surface collapsing, mesh discontinuities, or degenerate triangles. These topological artifacts cause the pathfinding algorithm to encounter dead ends or fail to compute the inscribed spheres, resulting in aborted centerlines. Conversely, the high-resolution surface meshes generated from the MACS-18 dataset preserve the continuous lumen topology even across severely diseased and narrowed segments. This continuous geometric definition provides a highly regular and unbroken Voronoi network, allowing the algorithm to successfully trace and connect distal endpoints back to the root, thereby achieving a $95.62\\%$ global extraction success rate.

# **2 Pipeline Validation on ASOCA**

CESRNormal \= Number of correctly extracted centerlinesNumber of attempted centerline extractions \= 267321 \= 83.18%  
CESRDiseased \= Number of correctly extracted centerlinesNumber of attempted centerline extractions \= 228274 \= 83.21%  
CESRTotal \= Number of correctly extracted centerlinesNumber of attempted centerline extractions \= 495595 \=  83.19%